title,director,year,genre,rating,description,poster_url
Inception,Christopher Nolan,2010,Sci-Fi,8.8,A thief enters people's dreams to steal and plant ideas.,https://m.media-amazon.com/images/I/71DwIcSgFcS.jpg
Interstellar,Christopher Nolan,2014,Sci-Fi,8.7,A group of explorers travel through a wormhole in space.,https://m.media-amazon.com/images/I/91kFYg4fX3L.jpg
The Dark Knight,Christopher Nolan,2008,Action,9.0,Batman faces the Joker in Gotham City.,https://m.media-amazon.com/images/I/81CLFQwU-WL.jpg
Spirited Away,Hayao Miyazaki,2001,Animation,8.6,A young girl enters a mysterious spirit world.,https://m.media-amazon.com/images/I/81m7Jhj0J4L.jpg
Parasite,Bong Joon-ho,2019,Drama,8.5,A poor family schemes to become employed by a wealthy family.,https://m.media-amazon.com/images/I/91KArYP03YL.jpg
The Matrix,Lana Wachowski and Lilly Wachowski,1999,Sci-Fi,8.7,A hacker discovers the nature of his reality.,https://m.media-amazon.com/images/I/51EG732BV3L.jpg